Quote,Author,Source,Theme
"Reversed course on this, and bought the weekend house. The kids love it beyond belief, we're building memories as a family, and it's amazing to have a home away from home gataway. Is it a good investment? No, but who cares. It's one of the best things we ever did!",@realEstateTrent,X,Fatherhood & Family
"Test. A person adopts another’s Frame when he accepts the other view of the world. For example, if you become self-conscious or question yourself when your wife tells you ‘all you ever think about is sex’ you are accepting her view of reality in place of your view of reality. That is not a strong Frame and it is definitely not you at your best.",Bluepill Professor,Saving a Low Sex Marriage,Marriage & Love
"(While it is true that we generally live longer than people used to, or than people in some traditional cultures do, most of our added years owe to gains in infant mortality and child health, not diet.)",Michael Pollan,Food Rules,"Time, Mortality & Impermanence"
"“In the depths of winter, I finally learned that within me there lay an invincible summer,” said Albert Camus. We must only outlast the season.",John Soforic,The Wealthy Gardener,"Money, Wealth & Enough"
"The Monk encourages us to consider how we spend our time, not our money. Marrying our values and passions to the energy we invest in work, it suggests, increases the significance of each moment.",Randy Komisar with Kent Lineback,The Monk and the Riddle,"Business, Startups & Strategy"
"Freed from your usual duties, released from the constraints of your day-to-day identity, you find the mental space to do something a little bit different.",Anne-Laure Le Cunff,Tiny Experiments,"Discipline, Habits & Focus"
"Disposing of corpses is an important part of public hygiene, and many areas of India effectively relied on vultures to assist with that job. Once vultures started to decline, places where they were helping with corpse cleanup experienced an uptick in human mortality.",@cremieuxrecueil,X,"Time, Mortality & Impermanence"
"If we reframe the question of how we spend our time, however, we can start to figure out how long each of our tasks actually takes. Perhaps we need only four hours a day to get our work done.",Paul Jarvis,Company of One,"Business, Startups & Strategy"
"In contrast, a disc subjected to high compressive loads that do not involve bending (i.e. good form with the powerlifts) will get stiffer and resilient to delamination. This is what the strength athlete needs. Most athletes cannot have it both ways – that being a mobile spine that bears high load. Strength athletes should avoid yoga, and spine stretching. Buttwink, when squatting, will eventually cause problems in most people. Stay tight, “locked in,” let the hips power the rigid torso.",Stuart McGill and Brian Carroll,Gift of Injury,"Health, Body & Longevity"
"The “Modern Critical Essays” series, edited by Harold Bloom (1984: Modern Critical Essays; Anna Karenina: Modern Critical Essays, and so on) contains essays by a number of well-known critics and will give you a good overview of the critical take on a work.",Susan Wise Bauer,The Well-Educated Mind,"Reading, Writing & the Life of the Mind"
Hi Casey. I’m reading a book about how to bring my friends together and host a cocktail party. I want to throw my first one on Wednesday the 8th at 7 p.m. Would you come? Can I send you some more info?,Nick Gray,The 2-Hour Cocktail Party,"Friendship, Community & Belonging"
"After that, I decided to write down the three things I want for each of the people I love the most and then ask: Am I investing in those things in their lives? Am I putting my time, energy, affection, expertise, and money toward the development of these assets and qualities? Am I modeling them with my own behavior? Do I need a new investment strategy?",Arthur C. Brooks,From Strength to Strength,"Purpose, Meaning & the Second Half of Life"
"I was too proud (aka insecure) to reach out to potential new friends to see if anyone wanted to hang out, for fear of rejection. And I know now that I’m not alone in feeling these things.",Radha Agrawal,Belong,"Friendship, Community & Belonging"
How could it be that “guys who know where the market is heading are no longer at the Board of Trade. They are either retired or broke. And I can’t think of any that are retired.” Classic Klipp.,Mark Spitznagel,The Dao of Capital,Investing & Markets
"Some people, usually senior men, work at home one day a week; this is a particularly common method of time-consolidation for editors or research scientists.",Peter F. Drucker,The Effective Executive,"Business, Startups & Strategy"
"Catherine stood back up. “Bill Browder. He is CEO of the Hermitage Fund, which is the biggest investor in the Russian stock market. And I believe the prime minister of the United Kingdom might have discussed this with you today.”",Bill Browder,Red Notice,"Business, Startups & Strategy"
"His lack of an undergraduate degree threatened to derail him, but a family friend, former Harvard Law School Dean Roscoe Pound, interceded on Charlie's behalf. Charlie was admitted, despite the determination of the admissions office to first send him back to college.",Charles T. Munger (edited by Peter D. Kaufman),Poor Charlie's Almanack,"Friendship, Community & Belonging"
"There was a common but shortsighted feeling that the first job out of school was a life-or-death decision. In reality, these first jobs are often all but irrelevant, given the direction that our careers later take.",Guy Spier,The Education of a Value Investor,"Time, Mortality & Impermanence"
YOU ARE NOT STARVING. Humans can survive thirty days without food. You can make it a few extra hours. You can actually make it a few days without any issue. I fast twenty-four hours fairly regularly. I do seventy-two-hour fasts approximately every three months.,Jocko Willink,Discipline Equals Freedom,"Discipline, Habits & Focus"
"Act with fortitude and honor,” he wrote to a distraught friend in serious financial and legal trouble of the man’s own making. “If you cannot reasonably hope for a favorable extrication, do not plunge deeper. Have the courage to make a full stop.",Ryan Holiday,Ego Is the Enemy,"Ambition, Risk & Courage"
"There is hope. We know four of the most important sources of marital conflict in the transition to parenthood: sleep loss, social isolation, unequal workload, and depression. We will examine each. Couples who make themselves aware of these can become vigilant about their behavior, and they tend to do better. We also know that not every marriage follows this depressing course of events.",John Medina,Brain Rules for Baby,Fatherhood & Family
“Love the Lord your God…with all your mind” (Matthew 22:37).,Ron Rhodes,5-Minute Apologetics for Today,Faith & the Sacred
"His recommended reading materials (see Appendix) provide some guidance. Guns, Germs, and Steel, The selfish Gene, Ice Age, and Darwin's Blind Spot all have a certain theme: a focus on the aforementioned issue of ""competitive destruction"" and an examination of why some entities are nevertheless able to adapt, survive, and even dominate over time.",Charles T. Munger (edited by Peter D. Kaufman),Poor Charlie's Almanack,"Discipline, Habits & Focus"
"Despite several millennia of such warnings, however, there is still an overwhelming social compulsion — an insanity of consensus, if you will — to get rich from life rather than live richly, to “do well” in the world instead of living well.",Rolf Potts,Vagabonding,"Adventure, Travel & the Good Life"
Anyway so I think guys should roll up their sleeves. It’s a good look. It’s giving capable. It’s giving strong. It’s giving “I got this.” Plus I like seeing veins. And cool watches.,@rachcorrine,X,"Adventure, Travel & the Good Life"
"In the decade since, he’s devoted a prolific research career toward studying the relationship between giving and success. Grant has found that people fall into one of three orientations: There are givers, who seek opportunities to give to others without expectation of anything in return; takers, who hoard resources and look for ways others can serve them; and finally matchers, who like to give as much as they get.",Keith Ferrazzi,Never Eat Alone,"Friendship, Community & Belonging"
"How can you focus exclusively on whether another child would make you happier? What about the child? Unless your baby is truly unlucky, he will almost certainly be happy to be alive.",Bryan Caplan,Selfish Reasons to Have More Kids,Fatherhood & Family
"It’s pretty easy to tell when someone is, and isn’t, investing in inspiration. I’ve never met anyone yet who was living his or her passion—I mean “pedal to the metal”—who was not a heavy investor in inspiration.",Zig Ziglar,Better Than Good,"Character, Ego & Integrity"
"Remember, in recession, it’s not just houses that are cheap. They’re giving cars away, and you can go to Best Buy and buy the whole store. Everything is on sale.",Jared Dillian,No Worries,"Money, Wealth & Enough"
"𝗖𝗼𝗹𝘂𝗺𝗯𝘂𝘀: Two strangers bond over architecture and family struggles, their quiet conversations healing wounds neither knew they had.",@bluewmist,X,"Adventure, Travel & the Good Life"
"The major foci of the coffeehouse were coffee, camaraderie, and acoustic music. The music was mostly traditional folk and bluegrass and what we called “homemade music,” now commonly described as “contemporary folk.” For years, the Post was the only venue in New Orleans for local singer/songwriters of contemporary folk music. Weekly “open mic” nights were open to any musicians as an informal audition.",Ray Oldenburg,Celebrating the Third Place,"Friendship, Community & Belonging"
"Pogačar in press conference: ""We witnessed one of the greatest performances on the climb ever. When I checked my numbers after it was really crazy, especially the part where Mateo Jorgenson and Jonas went on the front. Those were the highest numbers I ever did in my career.""",@CyclingGraphs,X,"Work, Craft & Calling"
Major life cheat code: Learn to work without validation. Write when nobody’s reading. Build when nobody’s watching. Train when nobody’s cheering. It doesn’t take talent. It just takes courage. Those with the courage to work in the dark will eventually shine in the light.,@SahilBloom,X,"Ambition, Risk & Courage"
"In his parable of Gyges in The Republic, a shepherd finds a ring, the turning of which on his finger makes him invisible. Because he is thus rendered invisible, he can rob or exploit his neighbors at will, since he is free from the risk of consequences. Would any of us act morally if we knew we were not to be held accountable?",James Hollis,Why Good People Do Bad Things,Human Nature & Psychology
"Without growth, meritocracy is just a nice word. How do you create opportunities for the most talented people if a company is not expanding? How do you remunerate your most successful employees if the firm’s earnings are not increasing?",Cristiane Correa,Dream Big,"Business, Startups & Strategy"
"We recommend capitalizing R&D expenses in return on invested capital, or ROIC, calculations, as they are core investments in the business. In addition, we don’t like to see prolonged cuts in this line item for cost-saving purposes.",Heather Brilliant and Elizabeth Collins,Why Moats Matter,Investing & Markets
"I am extremely disappointed in this site for killing both DMs and threads. There has been a definite and extreme turn towards promoting slop, low-quality engagement, and moving effortful post-making over to different websites. Total own-goal.",@cremieuxrecueil,X,"Learning, Genius & Mastery"
"The thing is, it's really hard to be roommates with people if your suitcases are much better than theirs--if yours are really good ones and theirs aren't. You think if they're intelligent and all, the other person, and have a good sense of humor, that they don't give a damn whose suitcases are better, but they do. They really do. It's one of the reasons why I roomed with a stupid bastard like Stradlater. At least his suitcases were as good as mine.",J. D. Salinger,The Catcher in the Rye,"Adventure, Travel & the Good Life"
"We may not be able to control the financial markets, but we can exert some control over our own bodies, what we eat, how often we go to the gym, who we spend time with, etc. By doing so we gain a toehold amidst the chaos, and this can convince us – delude us, if you will – into believing we are in charge.",John Coates,The Hour Between Dog and Wolf,Human Nature & Psychology
"The accounting mumbo jumbo stocks should lead a stockholder to conclude: If you own it and cannot understand it, sell it. If you do not own it and cannot understand it, consider selling it short if you think the obscurity is just the tip of the iceberg.",Kathryn F. Staley,The Art of Short Selling,Investing & Markets
"This is where it begins. In the darkness. Before the sun and the birds and the world. Every day. When the alarm sounds. IT IS TIME. Rise. Despite fatigue and soreness. Curse the warmth of the bed. Curse the comfort of the pillow. Fight the temptation of weakness. Get up and go. Do it quickly, without thought. Do not reason with weakness. You cannot. You must only take action. Get up and GO.",Jocko Willink,Discipline Equals Freedom,"Discipline, Habits & Focus"
"The philosophy asserts that virtue (meaning, chiefly, the four cardinal virtues of self-control, courage, justice, and wisdom) is happiness, and it is our perceptions of things—rather than the things themselves—that cause most of our trouble.",Ryan Holiday and Stephen Hanselman,The Daily Stoic,"Ambition, Risk & Courage"
"Lorna Court, a block of apartments encapsulating all Johannesburg’s supposed potential to become the next Manhattan, now stands for many as a symbol of the City of Gold’s decline. It is now an uninhabited, uninhabitable symbol of dilapidated and condemned architecture...",@tebogokhaas,X,"Discipline, Habits & Focus"
"It’s important here to interject the fact that we in those prisons were not an unsophisticated group. We were almost all fighter pilots, all had bachelor’s degrees, and more than half of us had at least one advanced degree.",James B. Stockdale,Thoughts of a Philosophical Fighter Pilot,Stoicism & Self-Mastery
"Interest in the private self was on the upswing, impelled not only by Protestantism but by capitalism, which encouraged each person to think of himself (or herself) as an individual, able to rise up through society’s levels toward wealth and leisure. The self was no longer part of a rigid, unshifting feudal system, with responsibilities beginning at birth and never changing thereafter. The self was free.",Susan Wise Bauer,The Well-Educated Mind,"Reading, Writing & the Life of the Mind"
Hard to believe that someone who writes and speaks so frequently about morality and ethics would use sex as a weapon and sleep with all of his female co-authors. A real head scratcher.,@robkhenderson,X,Human Nature & Psychology
"Instead of nitpicking everything that’s going “wrong,” you focus your awareness on all the things that are going right and feel grateful for those things.",Radha Agrawal,Belong,"Friendship, Community & Belonging"
The processes by which potential friends might find one another and by which friendships not suited to the home might be nurtured outside it are severely thwarted by the limited features and facilities of the modern suburb.,Ray Oldenburg,The Great Good Place,"Friendship, Community & Belonging"
Another of Uncle Henry’s nuggets of advice to the young came drifting back into his mind from years ago: There is nowhere else in the world where you can keep busy doing so little and enjoying it so much. One day you’ll understand.,Peter Mayle,A Good Year,"Adventure, Travel & the Good Life"
"In his book The Start-Up of You, Reid suggests making at least one quality introduction a month. If you can make them valuable, I’d say double that!",Keith Ferrazzi,Never Eat Alone,"Friendship, Community & Belonging"
"I was so enraged by this elitist attitude that I finally owned up to my own past and wrote about my ten-thousand-dollar college experience in The New York Times—about how my education was perfectly good, and how it gave me the opportunity to build my life and career.",Arthur C. Brooks,From Strength to Strength,"Purpose, Meaning & the Second Half of Life"
"Avoid compulsive whiners, chronic pessimists, mindless bleeding hearts, and self-conscious hipsters, since these kinds of people (who are surprisingly common along the travel trail) have a way of turning travel into a tiresome farce.",Rolf Potts,Vagabonding,"Adventure, Travel & the Good Life"
"If I could only give you one piece of career advice, it would be to always give more than is expected of you. When you do that, you instantly stand out as a person of character...There is no simpler formula for social and career success.",@robkhenderson,X,Human Nature & Psychology
We enhance most experiences in these two ways-by increasing the directness of our involvement in an activity and by increasing our social involvement.,Ray Oldenburg,The Great Good Place,"Friendship, Community & Belonging"
"But here’s the thing: you already have a terminal diagnosis. We all do! As the writer Edmund Wilson put it, “Death is one prophecy that never fails.” Every person is born with a death sentence. Each second that passes by is one you’ll never get back.",Ryan Holiday and Stephen Hanselman,The Daily Stoic,"Time, Mortality & Impermanence"
"Before I use these techniques or send any class out to practice these techniques, I remind myself and them of one everlasting rule that will dramatically increase your probability of success; it is all about them.",Robin Dreeke,"It's Not All About \""Me\",Human Nature & Psychology
"There is a pretty unanimous verdict that it is health promoting and the body composition research isn’t necessarily about finding out if it is ‘best’, as much as it is finding out if it is useful and why it might be useful.",Ben Carpenter,Everything Fat Loss,"Health, Body & Longevity"
It’s easy to understand how a man who spends the best part of his busy days at the pressure-packed juncture of life and death could become absorbed in philosophical thought.,James B. Stockdale,Thoughts of a Philosophical Fighter Pilot,"Time, Mortality & Impermanence"
"Clearly, the quality of a decision cannot be solely judged based on its outcome, but such a point seems to be voiced only by people who fail (those who succeed attribute their success to the quality of their decision).",Nassim Nicholas Taleb,Fooled by Randomness,Human Nature & Psychology
"A HEALTHY PERSON (v2) These are some of the most important factors to being a ""healthy"" person (or in other words, someone who reduces their mortality risk) Input from many peers for v2 here!",@drpetertierney,X,"Time, Mortality & Impermanence"
"Like Cope, however, I have embraced a broader conception of work and agree with him that the search for work worth doing is the real work and one of the most important pursuits in life.",Paul Millerd,The Pathless Path,"Work, Craft & Calling"
Self-doubt is that part of the soul that is able to taste the bitter in life as well as the sweet. It is open to a side of life that a sunny disposition must ignore in order to carry on smiling.,David Whyte,The Heart Aroused,"Work, Craft & Calling"
"Yet the same Robert C. Merton later introduced himself as the “founding partner” of a hedge fund that aimed at taking advantage of market inefficiencies. Setting aside the fact that Merton’s hedge fund blew up rather spectacularly from the black swan problem (with characteristic denial), his “founding” such a hedge fund requires, by implication, that he agrees with Shiller about the inefficiency of the market.",Nassim Nicholas Taleb,Fooled by Randomness,Human Nature & Psychology
"A basic industry with few players, rational management, barriers to entry, a lack of exit barriers and non-complex rules of engagement is the perfect setting for companies to engage in cooperative behaviour.",Edward Chancellor (editor),Capital Returns,Investing & Markets
"I used to be afraid of failing at something that really mattered to me, but now I’m more afraid of succeeding at things that don’t matter.",Bob Goff,Love Does,Faith & the Sacred
"Even the samurai oath is oriented toward action: I will never fall behind others in pursuing the way of the warrior. I will always be ready to serve my lord. I will honor my parents. I will serve compassionately for the benefit of others. Hagakure, the most famous collection of samurai wisdom, instructs: “The extent of one’s courage or cowardice cannot be measured in ordinary times. All is revealed when something happens.”",Ben Horowitz,What You Do Is Who You Are,"Business, Startups & Strategy"
"Be persistent, but never pushy. Masculine initiation should say ""I'm coming to get you, girl!"" If she needs time, respect it. Anticipation is your best friend. Let her know you’re looking forward to it when the time is right, and watch how the dynamic changes.",@georgehayworth,X,"Character, Ego & Integrity"
"The Vocabulary from Classical Roots series, also from Educators Publishing Service, is a good follow-up to Wordly Wise. As a matter of fact, many readers (not just those doing remedial work) may find this series helpful in preparing to read classic literature. Each lesson gives several Greek or Latin roots, lists of familiar words using those roots, and lists of unfamiliar words along with exercises in proper use.",Susan Wise Bauer,The Well-Educated Mind,"Reading, Writing & the Life of the Mind"
"An efficient home-delivery media system, in contrast, tends to make shut-ins of otherwise healthy individuals; the more people receive news in isolation, the more they become susceptible to manipulation by those who control the media.",Ray Oldenburg,The Great Good Place,"Friendship, Community & Belonging"
Montessori gave us the greatest educational philosophy ever created. A deep knowledge curriculum pushed as young as possible. A maniacal focus on sustained concentration and joy in work. A radical pro-civilization and pro-human bent. And a fundamental goal of fostering agency.,@mbateman,X,"Learning, Genius & Mastery"
You also don’t need to quit your job to conduct your experiment full time. Albert Einstein conducted most of his research while being employed as a patent examiner. Haruki Murakami wrote his first two books while running a jazz club.,Anne-Laure Le Cunff,Tiny Experiments,"Discipline, Habits & Focus"
It took several years and many smaller trips to decide that sailing for more than a year was something they definitely wanted to do.,Paul Millerd,The Pathless Path,"Work, Craft & Calling"
"Dealing a severe blow to the company, the agency had declared its nanotainer an uncleared medical device and forbidden it from continuing to use it, he said.",John Carreyrou,Bad Blood,"Business, Startups & Strategy"
"The first thirteen years of my conscious life, school was a prison-like environment. You must go there every day; you cannot leave. You have no control over your environment. You cannot avoid other kids in school, and I was simply not part of the social network.",Eric Jorgenson,The Anthology of Balaji,"Business, Startups & Strategy"
"As Pascal observed three hundred years ago, “When we read too fast or too slowly, we understand nothing.”",Mortimer J. Adler and Charles Van Doren,How to Read a Book,"Reading, Writing & the Life of the Mind"
"“I am an artist, a painter. One question I ask my students is, ‘What is beauty?’They struggle with a definition and each one is specifically unique, but a consensus emerges of a feeling inside, a good, wholesome, intangible, transcendent feeling. It is a feeling of the moment, of here, now, and of place.",Ray Oldenburg,Celebrating the Third Place,"Friendship, Community & Belonging"
"Whereas we are used to keeping our social blinders on in modern retail situations, the atmosphere of a third place, both physical and social, fosters a convivial openness. This openness, however, should not be confused with a contact or therapy group, since people are not required to be social, only invited to be so.",Ray Oldenburg,Celebrating the Third Place,"Friendship, Community & Belonging"
"Instead, he found himself dispensing wisdom more than knowledge—advice about life and leadership. “You are our modern elder,” they told him. At first, he took umbrage at this title.",Arthur C. Brooks,From Strength to Strength,"Purpose, Meaning & the Second Half of Life"
"Eleazar refused to be ensnared any longer. Everyone else ran from the enemy, but he put his foot down and said, “I’m not running. I will fight until I drop dead or until I drop to the field in victorious exhaustion. This is my moment, live or die.”","Stephen Arterburn, Fred Stoeker and Mike Yorkey",Every Man's Battle,Marriage & Love
"While it was a job, and a job I took seriously, running the restaurant also afforded me great pleasure and it was a privilege to meet the people I did without losing the professionalism it was so important to maintain.",Antonio Carluccio,A Recipe for Life,"Work, Craft & Calling"
"Heraclitus, a philosopher born in the Persian Empire back in the fifth century BC, had it right when he wrote about men on the battlefield. “Out of every one hundred men,” he wrote, “ten shouldn’t even be there, eighty are just targets, nine are the real fighters, and we are lucky to have them, for they make the battle. Ah, but the one, one is a warrior…”",David Goggins,Can't Hurt Me,"Discipline, Habits & Focus"
