Quote,Author,Source,Theme
"Well, get ready for it. It will happen. Maybe your parents will never be impressed. Maybe your girlfriend won’t care. Maybe the investor won’t see the numbers. Maybe the audience won’t clap. But we have to be able to push through. We can’t let that be what motivates us.",Ryan Holiday,Ego Is the Enemy,"Character, Ego & Integrity"
Greatness comes from humble beginnings; it comes from grunt work. It means you’re the least important person in the room—until you change that with results.,Ryan Holiday,Ego Is the Enemy,"Ambition, Risk & Courage"
"The way we often see this play out for people who take time away from the workforce to raise their kids is that when the nest is empty, they return to work in a different kind of role than the one they left years earlier.",Arthur C. Brooks and Oprah Winfrey,Build the Life You Want,"Purpose, Meaning & the Second Half of Life"
"They were not engineers or marketers, they were buccaneers, cunning underdogs, going up against the Establishment in the name of excellence and innovation. “It’s better to be a pirate than join the navy!” Jobs urged in one of his trademark epigrams, and they raised a skull and crossbones over Bandley.","Warren Bennis, Patricia Ward Biederman",Organizing Genius,"Business, Startups & Strategy"
"My wife’s path to faith was different. She was raised in ultra-secular Barcelona. (If you are thinking, “But Spain is a very religious place,” your views are out of date—Spain today is effectively a post-Christian country . . . think Denmark.)",Arthur C. Brooks,From Strength to Strength,"Purpose, Meaning & the Second Half of Life"
"Ten brave men, wellarmed but lacking faith in their leaders would not dare to attack the lion. Those same ten men, trusting their leaders, become the lion.",Ari Kiev,Hedge Fund Masters,"Ambition, Risk & Courage"
Stop all torso stretching exercises. You need a stiffened spine to bear load. Pulling your knees to your chest is a dated and misinformed “cure” for back pain and should be the first thing to go!,Stuart McGill and Brian Carroll,Gift of Injury,"Health, Body & Longevity"
"The job of the wise person is to swallow the frustration and just go on setting an example of caring and digging and diligence in their own lives. What a wise person teaches is the smallest part of what they give. The totality of their life, of the way they go about it in the smallest details, is what gets transmitted.",David Brooks,The Road to Character,"Character, Ego & Integrity"
"As I read about the Stoics, I found myself filled with admiration for them. They were courageous, temperate, reasonable, and self-disciplined—traits I would like to possess. They also thought it important for us to fulfill our obligations and to help our fellow humans—values I happen to share.",William B. Irvine,A Guide to the Good Life,"Ambition, Risk & Courage"
"And those who come together in the night and are entwined in rocking delight do an earnest work and gather sweetnesses, gather depth and strength for the song of some coming poet, who will arise to speak of ecstasies beyond telling.",Rainer Maria Rilke,Letters to a Young Poet,"Reading, Writing & the Life of the Mind"
Five questions that beat “What do you do?” What are you most excited about? What are you finding challenging right now? What’s the first birthday memory you have? What do you spend most of your time thinking about these days?,Radha Agrawal,Belong,"Friendship, Community & Belonging"
"You dictate a quick audio memo to your phone as you drive, which gets automatically transcribed and saved in your notes.",Tiago Forte,Building a Second Brain,"Reading, Writing & the Life of the Mind"
A fellow and his business should be bosom friends in the office and sworn enemies out of it. A clear mind is one that is swept clean of business at six o’clock every night and isn’t opened up for it again until after the shutters are taken down next morning.,George Horace Lorimer,Letters from a Self-Made Merchant to His Son,"Money, Wealth & Enough"
"One common example is when family members have been left in the dark on the wealth planning, and they don’t start discussing the wealth until the patriarch dies and the estate is being settled. The patriarch may have put several important wealth initiatives and structures in motion but communicated none of it to the family. The family is not used to (or comfortable with) discussing wealth.",Frazer Rice,"Wealth, Actually","Money, Wealth & Enough"
"When I read the works of the Stoics, I encountered individuals who were cheerful and optimistic about life (even though they made it a point to spend time thinking about all the bad things that could happen to them) and who were fully capable of enjoying life’s pleasures (while at the same time being careful not to be enslaved by those pleasures).",William B. Irvine,A Guide to the Good Life,Stoicism & Self-Mastery
"Unfortunately, the greater fool theory works only until it doesn’t. Valuation eventually comes into play, and those who are holding the bag when it does have to face the music.",Howard Marks,The Most Important Thing,Investing & Markets
"Belong is an incredibly empowering book because it puts the responsibility for finding and creating the communities that will fulfill us squarely on our own shoulders, while simultaneously teaching us the skills we need to do exactly that.",Radha Agrawal,Belong,"Friendship, Community & Belonging"
Ana listened with rising unease. She’d assumed Theranos had perfected its blood-testing technology if it was going to be used on patients. Now Aaron was telling her it was still very much a work in progress. Ana knew the Tennessee study involved people dying of cancer. It bothered her to think they might be used as guinea pigs to test a faulty medical device.,John Carreyrou,Bad Blood,"Business, Startups & Strategy"
Square pegs were made for round holes on the theory that they naturally lock together as the green wood of the rafters seasons and tightens up around the already seasoned hardwood peg.,Alexander Langlands,Cræft,"Work, Craft & Calling"
"We also gave teams a primer on teamwork based on insights gleaned from research in group dynamics. On the one hand, we warned, groupthink is a danger. Be cooperative but not deferential. Consensus is not always good; disagreement not always bad. If you do happen to agree, don’t take that agreement—in itself—as proof that you are right. Never stop doubting. Pointed questions are as essential to a team as vitamins are to a human body.",Philip E. Tetlock and Dan Gardner,Superforecasting,"Learning, Genius & Mastery"
"This is, in a way, a practical book about the Kelly criterion. I bought two copies by mistake. If we’re having lunch and you are interested, remind me to bring you the spare copy. Haghani btw is “the” Haghani. With Larry Hilibrand, the real on-the-ground PM at LTCM.",@__paleologo,X,"Reading, Writing & the Life of the Mind"
"My public writing journey started on an app called Quora, where I answered users’ questions across a wide range of topics. For years I answered the occasional question, mostly on topics I knew a lot about.",Paul Millerd,The Pathless Path,"Work, Craft & Calling"
"Threat of war: Dollar falls. Threat of war: Dollar rises. Which of the two will actually happen? After the fact, it seems obvious; in hindsight, fundamental analysis can be reconstituted and is always brilliant. But before the fact, both outcomes may seem equally likely. So how can one base an investment strategy and a risk profile entirely on this one dubious principle: I can know more than anybody else?",Benoit Mandelbrot and Richard L. Hudson,The Misbehavior of Markets,Investing & Markets
Apparently these husbands and wives who are happily married recognize the wisdom of accepting their mates as they are and the futility of seeking perfection and trying to change them.,Zig Ziglar,Courtship After Marriage,Marriage & Love
"If you’re looking for a formula for greatness, the closest we’ll ever get, I think, is this: Consistency driven by a deep love of the work.",Tim Ferriss,Tools of Titans,"Ambition, Risk & Courage"
Just integrating the information from our genes with our gut microbiome has substantially increased our medical forecasting capability across common chronic diseases.,Eric Topol,Super Agers,"Health, Body & Longevity"
"Be the guy. If you want to live an extraordinary life, you have to be the guy. Be the guy to make everything happen. Plan the nights out, book the trips. Get the first round of drinks. Send shots to the girls table. Crack jokes. Put everyone in a good mood. Lead by example. Lift all tides. Life is what you make it & it goes best for the people who play the leading role in making it special.",@colejaczko,X,"Reading, Writing & the Life of the Mind"
"If you’re looking for a formula for greatness, the closest we’ll ever get, I think, is this: Consistency driven by a deep love of the work.",Tim Ferriss,Tools of Titans,"Discipline, Habits & Focus"
"Iain McGilchrist on how we've become mesmerised by a mechanistic, reductionist way of thinking. From his magnum opus, 𝘛𝘩𝘦 𝘔𝘢𝘵𝘵𝘦𝘳 𝘸𝘪𝘵𝘩 𝘛𝘩𝘪𝘯𝘨𝘴.",@TheaEuryphaessa,X,Faith & the Sacred
"Spiritual growth is similar to bodily growth—very gradual. It takes place over a lifetime at an incremental, at times imperceptible rate.",John Mark Comer,Practicing the Way,Faith & the Sacred
"What I learned from Randy changed my view permanently about what it meant to have a friendship with Jesus. I learned that faith isn’t about knowing all of the right stuff or obeying a list of rules. It’s something more, something more costly because it involves being present and making a sacrifice. Perhaps that’s why Jesus is sometimes called Immanuel—“God with us.”",Bob Goff,Love Does,Faith & the Sacred
"When you choose manhood, you are choosing to be true to your created core. You are choosing to find and fight big battles for God, to live out great adventures in His kingdom, and to protect the beauty in your life, especially your wife and kids. That’s what life for genuine men has always been about.","Stephen Arterburn, Fred Stoeker and Mike Yorkey",Every Man's Battle,Marriage & Love
"We seem to be continually in the position, described by Dr. Alfred North Whitehead, of not being able to bring half an umbrella to work just because the weatherman says there’s a 50 percent chance of rain.",James B. Stockdale,Thoughts of a Philosophical Fighter Pilot,Stoicism & Self-Mastery
"About a decade ago, a theory emerged: If men do more of the housework and child care, fertility rates will rise! Men have been doing increasingly large shares of the housework and child care. Fertility is lower than ever.",@cremieuxrecueil,X,"Learning, Genius & Mastery"
"These are men with bold ideas, but highly critical of their own ideas; they try to find whether their ideas are right by trying first to find whether they are not perhaps wrong.",Nassim Nicholas Taleb,Fooled by Randomness,Human Nature & Psychology
WHO DO YOU PICK WHEN YOUR EGO SEEMS THREATENED? Back in the world of combat sports and jiu-jitsu: “It’s very interesting to observe who the top competitors pick out when they’re five rounds into the sparring sessions and they’re completely gassed. The ones who are on the steepest growth curve look for the hardest guy there—the one who might beat them up—while others look for someone they can take a break on.”,Tim Ferriss,Tools of Titans,"Character, Ego & Integrity"
"The tolerance peddlers are further exposed as frauds when you consider that they simply will not practice what they preach—at least toward those annoyingly stubborn Christians. They are absolutely unwilling to “tolerate” the Christian premise that Jesus Christ is the Way, the Truth, and the Life. For them to acknowledge this would necessarily refute their concept of tolerance, which holds that all ideas are of equal merit. In their infinite resourcefulness, they carve out an exception to their demand for universal tolerance when it comes to their treatment of Christians.",Norman L. Geisler and Frank Turek,I Don't Have Enough Faith to Be an Atheist,Faith & the Sacred
"Early retirement is criticized by Cicero as virtually unthinkable. He cites the moral idea of Pythagoras that ""no man should quit his post but at the command of his General; that is, of God himself.""",Charles T. Munger (edited by Peter D. Kaufman),Poor Charlie's Almanack,Faith & the Sacred
As the billionaire Charles Koch once explained of the main lesson he learned from his father’s very hands-on parenting: you can’t lecture your kids on anything you don’t live up to.,Ryan Holiday,The Daily Dad,Fatherhood & Family
"Always enjoy Bill Nygren: ""But the growth graveyard is full of companies that early in my career were considered “compounders:” Pitney Bowes (mailing machines), Yellow Pages, newspapers, cable networks""",@lhamtil,X,"Work, Craft & Calling"
"What do you want people to think when they hear or read your name? What product or service can you best provide? Take your skills, combine them with your passions, and find out where in the market, or within your own company, they can best be applied.",Keith Ferrazzi,Never Eat Alone,"Friendship, Community & Belonging"
"In our research we actually have a technical name for what Olivia and Nathaniel did. Probably unwittingly, they used a repair attempt. This name refers to any statement or action—silly or otherwise—that prevents negativity from escalating out of control.",John M. Gottman,The Seven Principles for Making Marriage Work,Marriage & Love
"Recently I reread letters I wrote to friends and lovers when I was twenty years old—before smartphones, Facebook, or any social media came into the world—and I was astonished at the difference of depth of feeling in my writing compared to my one emoji thumbs-up responses today.",Radha Agrawal,Belong,"Friendship, Community & Belonging"
"Ironically, in our attempts to avoid the difficult path of discipleship, we make our life harder, not easier. In our pursuit of happiness over obedience, we make our life less and less happy. In our resistance to Jesus’ yoke, we end up shouldering the crushing burden of our own unsatisfied desires.",John Mark Comer,Practicing the Way,Faith & the Sacred
"Psychologist Dr. Gena Gorlin, who works with many high performers as a coach, points out that the idea that success results from suffering misses the obvious fact that most of the people that actually face extreme suffering “do not achieve great success.” The real lesson, she argues, is that “successful people are the ones who manage to find wisdom and perspective from their struggles.” They turn their challenges into a positive story.",Paul Millerd,Good Work,"Business, Startups & Strategy"
"The overall lesson of insatiability is that money alone cannot buy the deepest things we desire. Money never purchases love, or eternity, or God. It is the wrong means, the wrong road, the wrong search.",Os Guinness,The Call,Faith & the Sacred
"Reminder that many ""autism"" cases are people who would've been classified as ""retarded"" in earlier decades. We just wrongly classify them as having a different condition today, largely because the autism label gives greater access to services and it's less 'stigmatizing'.",@cremieuxrecueil,X,"Learning, Genius & Mastery"
"The idea that multivitamins just create ""expensive urine"" is a myth that's been put to rest by several large randomized controlled studies. A simple multi (i.e., Centrum Silver) has been shown to improve multiple domains of cognitive function in older adults. It's a very low-cost intervention to support healthy brain aging. Micronutrients matter.",@foundmyfitness,X,Human Nature & Psychology
In the summer camp study…once a boy was put down [verbally]…other (lower-status) boys in the cabin jumped in to cement this victim’s even-lower status. This was a means of establishing their own dominance over him…. Boys tend to be more often on the watch for opportunities to climb socially….,"Stephen Arterburn, Fred Stoeker and Mike Yorkey",Every Man's Battle,Marriage & Love
I suspect every culture and philosophy has some variation of what I cover here. Borrow from these traditions that which serves you.,Scott Galloway,The Algebra of Wealth,"Money, Wealth & Enough"
"If a fighter is not capable of learning and practicing every day, if he is not relentlessly looking for areas of improvement, examining his own shortcomings, and finding new techniques to borrow from peers and opponents, he will be broken down and destroyed.",Ryan Holiday,Ego Is the Enemy,"Character, Ego & Integrity"
"Chip now leads a retreat center helping those in their mid-life to mark and celebrate career transitions, including a program called Sabbatical Sessions.",Cady North,The Art of the Sabbatical,"Work, Craft & Calling"
"The future of healthcare isn’t one-size-fits-all. It’s personalized, real-time protocols all based on your biomarkers, habits, existing patient records, and goals. Everyone’s GHOAT is unique.",@tyler_smith,X,"Discipline, Habits & Focus"
"Instead a multi-stage life will emerge. Imagine you have two or three different careers: one perhaps when you maximize your finances and work long hours and long weeks; at another stage you balance work with family, or want to position your life around jobs that make a strong social contribution. The gift of living for longer means you don’t have to be forced into either/or choices.",Lynda Gratton and Andrew J. Scott,The 100-Year Life,"Purpose, Meaning & the Second Half of Life"
"I’ll admit I’ve become fascinated with the idea of restoring attention spans. Any good writing/research done regarding people who have quit their phone usage and attempted to restore concentration using only past distractions—books, newspapers, puzzles, etc.?",@BrandonMagner,X,"Discipline, Habits & Focus"
The NYT is in bad faith: any other leader (or NYT journalist) would have cowered on the floor. Trump exhibited exceptional physical courage; recognize the fact even if you disagree with the politics.,@nntaleb,X,Philosophy & the Examined Life
"I've gotten great results just from asking ""how would someone much better than me approach this?"" It's helped me learn fast as a beginner, and at times go from good to world-class. Mimicry & simulation are superpowers we overlook in favor of learning ""the right way."" More below.",@catehall,X,"Learning, Genius & Mastery"
"Sequester, the seizing of a families’ property by the state, so external sequestration, through, for example, taxation or confiscation, or the entropic dissolution of a families’ resources by, for example, its inability to resolve its internal disputes or to recover from its poor decision making and poor governance that are a function of those decisions, so internal sequestration, is always at the root of why families’ fail to maintain their quantitative fortunes.",Bogumil K. Baranowski,"Money, Life, Family","Money, Wealth & Enough"
"I also take a screen grab of a specific iPad Kindle page with my highlighted passage, and then email that screen grab into my Evernote email because Evernote has, as you know, optical character recognition. So, when I search within it, it’s also going to search the text in that image. I don’t have to wait until I finish the book to explore all my notes. . . . I love Evernote. I’ve been using it for many years, and I could probably not get through my day without it.”",Tim Ferriss,Tools of Titans,"Character, Ego & Integrity"
"My point is this: Relationships are solidified by trust. Institutions are built on it. You gain trust by asking not what people can do for you, to paraphrase an earlier Kennedy, but what you can do for others.",Keith Ferrazzi,Never Eat Alone,"Friendship, Community & Belonging"
"If we all did the things we are capable of, we would astound ourselves. ~ Thomas Edison",Sean DeLaney,Insights of the Ages,Philosophy & the Examined Life
"Later Clarkson would write that he’d obediently given up his worldly ambitions to follow the path God laid out for him. Quite the humblebrag. Clarkson was of course sincere in his empathy with the plight of enslaved people, but he hadn’t suddenly lost all sense of ambition. Far from it. He’d simply traded in his literary dreams for something much, much bigger, for what could be more momentous than the fight to end slavery?",Rutger Bregman,Moral Ambition,"Ambition, Risk & Courage"
"What role does spirituality or religious practice play in my daily search for meaning, regardless of my feelings in the moment or official beliefs?",Arthur C. Brooks,The Meaning of Your Life,Philosophy & the Examined Life
"Politicians, the inveterate masters of networking, have exchanged their networks in this fashion for years. They have what are called “host committees,” groups of people hailing from different social worlds who are loyal to a specific politician and charged with introducing their candidate to their respective circle of friends. A typical well-established politician will have a host committee of doctors, lawyers, insurance professionals, college kids, and so on.",Keith Ferrazzi,Never Eat Alone,"Friendship, Community & Belonging"
Going from zero weekly exercise to just ninety minutes per week can reduce your risk of dying from all causes by 14 percent. It’s very hard to find a drug that can do that.,Peter Attia with Bill Gifford,Outlive,"Time, Mortality & Impermanence"
"Mostly about weight training, which had gone from interest to passion and obsession shortly after. But I was obsessed in a good way, the kind that brings meaning and purpose to each day. With weight training, that never changed. To this day, weight training keeps me centered, and I’m worse off without it.",Martin Berkhan,The Leangains Method,"Health, Body & Longevity"
"Great Groups coalesce around a genuine challenge, a problem perceived as worthy of a gifted person’s best efforts. Much of the joy typical of Great Groups seems to reflect the profound pleasure humans take in solving difficult problems.","Warren Bennis, Patricia Ward Biederman",Organizing Genius,"Business, Startups & Strategy"
"Many parents would rather be copilots with their children than air traffic controllers. Some parents, unfortunately, try to be both. Parents should be more like air traffic controllers. They’re in the control tower and see what the pilots don’t see. They track the entire flight; yet, their role is to respond to pilot inquiry and advise of irregularities so the aircraft can avoid catastrophes. Of course, the air traffic controllers leave the flying of the plane to the pilot.",Richard Watts,Entitlemania,Fatherhood & Family
"Dads: a simple reframe that has helped me actually want to play with my kids more: There is going to be a last time that they ever ask me to play together, I won't know when that will be, and that I'll desperately wish for it again once it's past. Life is brief. Truly savor it.",@PatrickHeizer,X,Fatherhood & Family
"What warms a woman up is when her husband helps around the house, picks up after himself, helps with the children, makes arrangements for dates, and overall cares for her. If a husband consistently and graciously does this without acting like a martyr, he’s going to find, six times out of ten, that his wife is ready and eager to enjoy an active and fulfilling love life. It will be a natural response to a lifestyle of sincere affection.",Kevin Leman,Sheet Music,"Adventure, Travel & the Good Life"
"This mechanism I also call Wittgenstein’s ruler: Unless you have confidence in the ruler’s reliability, if you use a ruler to measure a table you may also be using the table to measure the ruler.",Nassim Nicholas Taleb,Fooled by Randomness,Human Nature & Psychology
"It’s when a woman is most likely to cheat on a partner, she is most likely to orgasm and in plain simple terms when she likes sex the roughest.",Athol Kay,The Married Man Sex Life Primer 2011,Marriage & Love
"The definition of Power is not financial success, status or influence over others, but the degree to which we have control over our own lives.",Rollo Tomassi,The Rational Male,Marriage & Love
"The more they were losing – in other words, the less control players had over the game – the more our study participants expected the rituals to work.",Dimitris Xygalatas,Ritual,"Discipline, Habits & Focus"
"The Stoic responds to the suffering of others like a good doctor who has seen it all before: with activity and compassion, though probably without much emotion.",Ward Farnsworth,The Practicing Stoic,Stoicism & Self-Mastery
"Cicero, like Cato before him, concedes that, in moderation and meritorious company, the convivial imbibing of wine improves life. So also with stays at one's country place, well tended by others, a practice also favored by Jefferson, who shared Cicero's conviction that such states fostered sound values.",Charles T. Munger (edited by Peter D. Kaufman),Poor Charlie's Almanack,"Learning, Genius & Mastery"
"Seasonality doesn’t refer only to slowing work for entire seasons. Varying your intensity at smaller timescales can also prove useful in achieving a more natural pace. The general goal for this proposition is to help you avoid working at a constant state of anxious high energy, with little change, throughout the entire year.",Cal Newport,Slow Productivity,"Discipline, Habits & Focus"
