Quote,Author,Source,Theme
It’s bad to have an opinion you’re proud of if you can’t state the arguments for the other side better than your opponents. This is a great mental discipline.,David Clark,Tao of Charlie Munger,Investing & Markets
"Thus, intangible values such as community, trust, friendship, and the beauty of creation became less important. It is hard to measure the value of friendship, unspoiled nature, and justice. But Gross National Income (GNI) is easy to measure. The result is our competitive growth economy where economic success and material things are all-important to many people.",Ronald J. Sider,Rich Christians in an Age of Hunger,Faith & the Sacred
"The payoff for portfolio investors such as Gabelli is that if they can identify firms selling substantially below their PMV, they can buy the shares and capture that control premium when the industrial buyer moves on the company.","Bruce C. N. Greenwald, Judd Kahn, Paul D. Sonkin, and Michael van Biema",Value Investing,Investing & Markets
"Ideologies which claim to be in possession of the ultimate truth are making a false claim; therefore, they can be imposed on society only by force. This applies to Communism, Fascism and National Socialism alike. All these ideologies lead to repression.",George Soros,The Soros Lectures,Investing & Markets
"Once blood caffeine levels are elevated, the goal is to simply maintain the elevated levels with repeated smaller doses of roughly 0.5-1mg/ kg every hour for the duration of the training bout or race.","Dr. Alex Harrison, Michelle Howe, and Dr. Melissa Davis",The RP Diet for Endurance,"Health, Body & Longevity"
"There’s no need for a certain hardware or software, and no need to use secret tactics or strategies. All you need is to be a decent human being with a valued skill set and a willingness to share what you know with people who’ll listen.",Paul Jarvis,Company of One,"Business, Startups & Strategy"
ALL ANIMALS ARE EQUAL BUT SOME ANIMALS ARE MORE EQUAL THAN OTHERS,George Orwell,Animal Farm,"Adventure, Travel & the Good Life"
"Occasion noise is the variability in judgments of the same case by the same person or group on different occasions. A surprising amount of occasion noise arises in group discussion because of seemingly irrelevant factors, such as who speaks first.","Daniel Kahneman, Olivier Sibony, Cass R. Sunstein",Noise,Human Nature & Psychology
The advantage of a ridiculously ambitious goal is that it sets the bar very high so even if your effort falls short it may exceed an ordinary success.,Kevin Kelly,Excellent Advice for Living,"Ambition, Risk & Courage"
Free Enterprise. An economic system in which markets and companies are privately owned and are free to compete against one another with minimal government restrictions.,Peter Sander,101 Things Everyone Should Know About Economics,"Money, Wealth & Enough"
"Materialism and consumerism, the collapse of biblical ethical standards, and the breakdown of the family have increased at a galloping pace.",Ronald J. Sider,Rich Christians in an Age of Hunger,Faith & the Sacred
"But in the late nineteenth and early twentieth centuries, realism developed offshoots. Dostoyevsky and Kafka perfected a “psychological realism” that pays less attention to physical details and more to psychological details. Rather than giving loving attention to the exact appearance of landscapes or furnishings, psychological realism tries to paint an accurate picture of the mind, so that the reader seems to be in direct contact with a character’s mental processes.",Susan Wise Bauer,The Well-Educated Mind,"Reading, Writing & the Life of the Mind"
"Strength may even trump cardiorespiratory fitness, at least one study suggests. Researchers following a group of approximately 1,500 men over forty with hypertension, for an average of about eighteen years, found that even if a man was in the bottom half of cardiorespiratory fitness, his risk of all-cause mortality was still almost 48 percent lower if he was in the top third of the group in terms of strength versus the bottom third.",Peter Attia with Bill Gifford,Outlive,"Time, Mortality & Impermanence"
"Our lives work like a plane or a car. We’d rather they didn’t—that they ran according to plan, foreseeable and undisturbed. Then we’d only have to focus on the set-up, the optimal starting point. We’d arrange things perfectly at the beginning—education, career, love life, family—and reach our goals as planned. Of course, as I’m sure you know, it doesn’t work like that.",Rolf Dobelli,The Art of the Good Life,Stoicism & Self-Mastery
"In the period of the Judges, the pattern in Israel was, according to one scholar, “free peasants on small land holdings of equal size and apportioned by the clans.”",Ronald J. Sider,Rich Christians in an Age of Hunger,Faith & the Sacred
"You are busy, but you have a vague anxiety that your life has not achieved its ultimate meaning and significance.",David Brooks,The Road to Character,"Character, Ego & Integrity"
"This is when I came across the work of Mark Verstegen, Joe DeFranco, Eric Cressey, Mike Robertson, Mike Boyle, and Martin Rooney. They were teaching a ton of glute exercises like glute bridges, bird dogs, and side-lying clams.","Bret Contreras, Glen Cordoza",Glute Lab,"Health, Body & Longevity"
Two vital admonitions for personal use of the scriptures entail reading (1 Timothy 4:13) and studying (2 Timothy 2:15) the Bible.,"Douglas D. Stauffer, Andrew B. Ray, and Rick Quatro",Daily Strength,Faith & the Sacred
The principles we will explore in detail are: 1. Boundary: The line between members and outsiders. 2. Initiation: The activities that mark a new member. 3. Rituals: The things we do that have meaning. 4. Temple: A place set aside to find our community. 5. Stories: What we share that allows others and ourselves to know our values. 6. Symbols: The things that represent ideas that are important to us. 7. Inner Rings: A path to growth as we participate.,Charles H. Vogl,The Art of Community,"Friendship, Community & Belonging"
"Two thoughts from Daniel Ek ""Innovation comes from not accepting the world as it is."" ""The best advice I ever got was that it's better to fail with your own vision than to succeed with someone else's.""",@jposhaughnessy,X,Philosophy & the Examined Life
"While its central subject is melancholy, it is at the same time a book about the relationship between the melancholic individual and the world, about the role of emotions and imagination in human life, and about the human condition throughout recorded history. It is also a book about books, their uses and their pleasures, and about the acts of writing and reading.",Robert Burton,The Anatomy of Melancholy,Philosophy & the Examined Life
"You figure that if the people around you seem to like you, you must be good enough. In the process you end up slowly turning yourself into something a little less impressive than you had originally hoped.",David Brooks,The Road to Character,"Character, Ego & Integrity"
"Over the weekend I built a demo of what I've been calling ""scoped propagators"" — a very simple primitive with remarkably diverse application. The same primitive can turn shapes into buttons, add layout constraints, create dynamic behaviour, and much more...",@OrionReedOne,X,"Purpose, Meaning & the Second Half of Life"
"In short, you must remember this—that if you hold anything dear outside of your own reasoned choice, you will have destroyed your capacity for choice.",Ryan Holiday and Stephen Hanselman,The Daily Stoic,Stoicism & Self-Mastery
"For so many, instead of looking for “cause of death” when they expire, we should be looking for “cause of life” when they are still around.",Nassim Nicholas Taleb,The Bed of Procrustes,"Time, Mortality & Impermanence"
"Earlier, I had always equated ambition with the default path of success. The path I left behind. There the definition of ambition was simple: an ambitious person aims at money, status, and an impressive career path. But slowly, I started to realize that my journey after quitting my job has reflected another kind of ambition. It wouldn’t land me on the cover of Fortune, but it has led me somewhere far better: to a life where I feel I can thrive.",Paul Millerd,Good Work,"Ambition, Risk & Courage"
"Influential economists and philosophers, including Marshall, Fisher, von Mises, Hicks, Hayek, Knight, Keynes, and Friedman, all wrote books and articles proposing differing theories of interest rates.",Victor Haghani and James White,The Missing Billionaires,Investing & Markets
"After a fight, he is always the first one to apologize. He cannot recall his wife ever saying she was sorry for any of her behaviors.",Robert A. Glover,No More Mr. Nice Guy,Marriage & Love
I highly recommend reading “The CEO of Automattic on Holding ‘Auditions’ to Build a Strong Team” from the April 2014 issue of the Harvard Business Review (find it on hbr.org).,Tim Ferriss,Tools of Titans,"Reading, Writing & the Life of the Mind"
"You want your son to be strong and to be honest. You want your daughters to be those things too. You want them to work hard, to help other people, to be respectful to their parents and the people they meet on the street. You want them to be clean and organized, to laugh and to be resilient. Of course you want those things. Everyone does. The question is, how do we raise good kids? The answer is staring you in the mirror.",Ryan Holiday,The Daily Dad,Fatherhood & Family
"This is the diving bell boat, would you dare to stand at the bottom of a river?",@TheFigen_,X,"Ambition, Risk & Courage"
"It is generally through the experience of unsolicited suffering that we grow larger, not because the unexamined life proved easier.",James Hollis,Finding Meaning in the Second Half of Life,"Purpose, Meaning & the Second Half of Life"
"Our lives as Christians are about growing as citizens of that kingdom, holding open the door for others and helping them through it, and, by our lives, continuing to resist and overcome the “un-Godness” still in our world that damages lives and obscures the kingdom. The kingdom of God is worthy of working for, living for, and dying for.",Darrow Miller and Marit Newton,LifeWork,"Time, Mortality & Impermanence"
"DID YOU EVER EAT the last piece of crusty, dried-out chocolate cake even though it tasted like chocolate-scented cardboard? Ever finish eating a bag of french fries even though they were cold, limp, and soggy? It hurts to answer questions like these.",Brian Wansink,Mindless Eating,"Health, Body & Longevity"
"The areas of great interest to the Stoics all make an appearance here: virtue, mortality, emotions, self-awareness, fortitude, right action, problem solving, acceptance, mental clarity, pragmatism, unbiased thought, and duty.",Ryan Holiday and Stephen Hanselman,The Daily Stoic,Stoicism & Self-Mastery
"After all, as Oswald Chambers wrote, “I have never met the man I could despair of after discerning what lies in me apart from the grace of God.”",Os Guinness,The Call,Faith & the Sacred
"My baseline well-being level—the level where I would sit if I didn’t study it and work on it every day—is significantly lower than average. It’s not as if I have had huge trauma or unusual suffering. No one should feel sorry for me. It just runs in the family: my grandfather was gloomy; my father was anxious; left to my own devices, I am gloomy and anxious.",Arthur C. Brooks and Oprah Winfrey,Build the Life You Want,"Purpose, Meaning & the Second Half of Life"
"When you compound changes over a massive number of action-feedback-adjustment cycles, you end up with massive changes and massive gains in performance.",@justinskycak,X,"Learning, Genius & Mastery"
"Fuel up at night. Filling your gas tank after dusk, especially during warmer months, releases less harmful pollution than fueling up by day.",Heidi Murkoff,What to Expect When You're Expecting,Fatherhood & Family
"This allows the flexibility to include added fats, added sugars, and alcohol. But here’s the catch: discretionary calories amount to roughly 10 to 20 percent of total daily caloric intake. The remaining 80 to 90 percent of the diet should come from whole and minimally refined foods. This guideline has withstood the test of time due to its realistic application of moderation.",Alan Aragon,Flexible Dieting,"Health, Body & Longevity"
"Did you guys know that the word ""daily"" in the Lord's Prayer is a wild-guess translation of a Greek word found nowhere else but in the Gospels, and no one actually knows what it means???",@_SatanWatch,X,Faith & the Sacred
We make presentations and have meetings because our ancestors did that. But now we make much better presentations and have many more meetings (with far less structure and purpose). These are the ritual gestures that define our lives. This is our rain dance.,@BuffaloBillCo,X,"Purpose, Meaning & the Second Half of Life"
"The irony is that much of this downtime could have been avoided. You must remind yourself daily (pray if you do, meditate, or write in a journal) that you and you alone are responsible for managing how much energy you devote.",Roy Cohen,The Wall Street Professional's Survival Guide,Investing & Markets
"Their consumption of olive oil, fruit, fresh vegetables and wine was higher, whereas their intake of milk, meat fat, beer and distilled liquors was lower.",Ben Carpenter,Everything Fat Loss,"Health, Body & Longevity"
"I once heard somebody say that God had closed a door on an opportunity they had hoped for. But I’ve always wondered if, when we want to do something that we know is right and good, God places that desire deep in our hearts because He wants it for us and it honors Him. Maybe there are times when we think a door has been closed and, instead of misinterpreting the circumstances, God wants us to kick it down. Or perhaps just sit outside of it long enough until somebody tells us we can come in.",Bob Goff,Love Does,Faith & the Sacred
"Endurance efforts lasting under two hours can be fueled solely with glucose, but once more than 30g/hr of carbohydrate intake is recommended, a mixture of glucose and fructose can be beneficial.","Dr. Alex Harrison, Michelle Howe, and Dr. Melissa Davis",The RP Diet for Endurance,"Health, Body & Longevity"
"In case you're not sold on genetically engineered Streptococcus mutans for preventing cavities, be aware, it also seems to eliminate morning breath.",@cremieuxrecueil,X,"Learning, Genius & Mastery"
"Jai tries to focus on each day, rather than the negative things down the road. “It’s not helpful if we spend every day dreading tomorrow,” she says.",Randy Pausch and Jeffrey Zaslow,The Last Lecture,"Time, Mortality & Impermanence"
"“A wet year reduces fires while increasing vegetation growth, but then the increased vegetation dries out in subsequent dry years, thereby increasing the fire fuel,” the National Oceanic and Atmospheric Administration wrote. That’s hardly intuitive, but here again—calm plans the seeds of crazy.",Morgan Housel,Same as Ever,Human Nature & Psychology
"The ancient Hindu Upanishads refer disdainfully to “that chain of possessions wherewith men bind themselves, and beneath which they sink”; ancient Hebrew scriptures declare that “whoever loves money never has money enough.” Jesus noted that it’s pointless for a man to “gain the whole world, yet lose his very self,”",Rolf Potts,Vagabonding,"Adventure, Travel & the Good Life"
"PRESIDENT ASSENTS TO THE CANNABIS PRIVATE PURPOSES BILL President @CyrilRamaphosa has signed into law the Cannabis for Private Purposes Act (“CfPPA”). The CfPPA regulates the cultivation, possession, and use of cannabis by adults in a private setting.",@PresidencyZA,X,"Purpose, Meaning & the Second Half of Life"
"Unfortunately, people’s intuitions in this regard are almost the mirror image of what they should be: people are very keen to get perfect hits and highly sensitive to small errors, but they hardly care at all about the difference between two large errors.","Daniel Kahneman, Olivier Sibony, Cass R. Sunstein",Noise,Human Nature & Psychology
The real test of your character is not how you deal with adversity— although that will teach you much. The real test is how you deal with power. The only cure for power is humility and the admission that your power comes from luck. The small person believes they are superior; the superior person knows they are lucky.,Kevin Kelly,Excellent Advice for Living,"Character, Ego & Integrity"
"Approaching public servants with courtesy and respect for their humanity and competence will, for the most part, evoke humanity and competence.",Donald C. Gause and Gerald M. Weinberg,Are Your Lights On?,"Learning, Genius & Mastery"
"They view this as the next rung on the investment ladder and desire the control and psychic rewards that come from attributing an annual performance number to their actions. It is difficult for a firm to keep great researchers for long periods of time for this reason. Compensation may increase drastically for these valued individuals, but most often it is the desire for control that compels them to move on.",Brian Bares,The Small-Cap Advantage,Investing & Markets
"If you write a lot for work, get good at distilling ideas. As @jasonfried writes: ""I believe editing is an essential skill that is often overlooked and under appreciated. The future belongs to the best editors.""",@david_perell,X,"Reading, Writing & the Life of the Mind"
"If you would improve, be content to be thought foolish and dull with regard to externals. Do not desire to be thought to know anything; and though you should appear to others to be somebody, distrust yourself.",Epictetus,The Enchiridion,Stoicism & Self-Mastery
"I’m anxious that you should be a good scholar, but I’m more anxious that you should be a good clean man. And if you graduate with a sound conscience, I shan’t care so much if there are a few holes in your Latin.",George Horace Lorimer,Letters from a Self-Made Merchant to His Son,"Money, Wealth & Enough"
"It’s for this reason that I am quite sure of two things. The first is that even uneducated people, whether sunk in the theocratic despotisms of yore, or the more modernised totalitarianisms of today (or the other way about, if you prefer) have an innate capacity to resist and, if not even to think for themselves, to have thoughts occur to them.",Christopher Hitchens,Letters to a Young Contrarian,Philosophy & the Examined Life
"This is called flavor programming, and you can do it soon after your baby is born, too. Lactating mothers who eat green beans and peaches while nursing produce weaned toddlers with the same preferences.",John Medina,Brain Rules for Baby,Fatherhood & Family
"The physician finds the philosopher alone in his garden, thinking and writing about melancholy and madness, and surrounded by the corpses of dissected animals. Pressed for an explanation of his laughter, Democritus delivers a diatribe about the insanity of his fellow human beings, mercilessly castigating their intellectual failings and moral weaknesses. Contemptuous derision, as he explains to Hippocrates, is the only possible response to the perception of humanity’s stupidity, vice and madness.",Robert Burton,The Anatomy of Melancholy,Philosophy & the Examined Life
"As a matter of fact, a reading partner with a very different background can help you to think more precisely, as you discover that you need to explain, clearly, ideas that you’ve always taken for granted.",Susan Wise Bauer,The Well-Educated Mind,"Reading, Writing & the Life of the Mind"
"Self-respect is produced by inner triumphs, not external ones. It can only be earned by a person who has endured some internal temptation, who has confronted their own weaknesses and who knows, “Well, if worse comes to worst, I can endure that. I can overcome that.”",David Brooks,The Road to Character,"Character, Ego & Integrity"
"True commandos aren’t restricted by the agenda that they receive at registration. Who says you can’t arrange your own dinner while at the conference, or put together an informal discussion on a particular topic that matters to you?",Keith Ferrazzi,Never Eat Alone,"Friendship, Community & Belonging"
"Once I saw the power of community, and felt the deep joy it brought to me personally, it became my mission to help create community for others too.",Radha Agrawal,Belong,"Friendship, Community & Belonging"
"I now spend my days working as a Community Architect, a term I coined for myself and for all those who spend their days bringing humans together.",Radha Agrawal,Belong,"Friendship, Community & Belonging"
"The more freedom we’re given to express ourselves, the more we want to be free of having to deal with anyone who may disagree with us or upset us. The more exposed we are to opposing viewpoints, the more we seem to get upset that those other viewpoints exist. The easier and more problem-free our lives become, the more we seem to feel entitled for them to get even better.",Mark Manson,The Subtle Art of Not Giving a F*ck,"Discipline, Habits & Focus"
"These flaws are the main reasons we keep repeating the same mistakes, and why we need to keep our feet on the ground as much as we can. As Confucius said, “A man who has committed a mistake and doesn’t correct it, is committing another mistake.”",Shane Parrish and Rhiannon Beaubien,The Great Mental Models,"Learning, Genius & Mastery"
I do only want to advise you to keep growing quietly and seriously throughout your whole development;,Rainer Maria Rilke,Letters to a Young Poet,"Reading, Writing & the Life of the Mind"
"EXTRA CONFIRMED: The stimulant patch that Sam preferred was EMSAM, a drug normally used to treat depression or Parkinson's, but used off-label for its alertness and focus benefits.",@AutismCapital,X,"Discipline, Habits & Focus"
"Since I need to hear this, perhaps you might as well... Vocation is not an identity. You are not your work. You are not your job title. You are not your performance. In good times, or bad. In wins, or losses. In big awards, or bankruptcy. You are valuable. Nothing else needed.",@BrentBeshore,X,"Purpose, Meaning & the Second Half of Life"
"The guideline, ""The Golden Rule;' clearly says that you should do unto your mate as you want your mate to do unto you. Please notice that the instructions say that you are to go first or initiate the action.",Zig Ziglar,Courtship After Marriage,Marriage & Love
"Envy, however, strikes him as the silliest of the Seven Deadly Sins, since it produces nothing pleasant at all. To the contrary, it simply makes the practitioner feel miserable.",Janet Lowe,Damn Right!,Investing & Markets
"“The best parties are a wild mixture. Take some corporation presidents, add…a bearded painter, a professional jockey, your visiting friends from Brussels, a politician, a hairdresser, and a professor of physics, toss them all together, and try to get them to stop talking long enough to eat! It’s especially important to have all age groups.",Nick Gray,The 2-Hour Cocktail Party,"Friendship, Community & Belonging"
"""The next thing most like living one's life over again seems to be a recollection of that life, and to make that recollection as durable as possible by putting it down in writing."" - Benjamin Franklin",Charles T. Munger (edited by Peter D. Kaufman),Poor Charlie's Almanack,"Reading, Writing & the Life of the Mind"
"by money once you have enough of it. Money matters a lot until it doesn’t. The writer Lawrence Yeo has a related article titled “The Nothingness of Money.” In it he argues that when faced with our own mortality, we quickly realize how little money actually matters. As Yeo wrote, “Money is a required pursuit for life, but a pointless pursuit upon death.”",Nick Maggiulli,The Wealth Ladder,"Time, Mortality & Impermanence"
"The Stoics were pioneers of the morning and nightly rituals: preparation in the morning, reflection in the evening.",Ryan Holiday and Stephen Hanselman,The Daily Stoic,Stoicism & Self-Mastery
"One of the most important actions a family of wealth can perform is to institute a process of family communication, including regular family meetings. Family meetings are excellent vehicles for passing on values, educating family members about finances and other topics, modeling the ability to communicate, and providing a fail-safe mechanism for times of stress, conflict, or crisis.",James Grubman,Strangers in Paradise,"Money, Wealth & Enough"
A recent succession of systematic reviews and meta-analyses have unanimously arrived at the conclusion that intermittent energy restriction is a viable and effective alternative to daily caloric restriction.,Martin Berkhan,The Leangains Method,"Health, Body & Longevity"
"Great companies don’t hire skilled people and motivate them, they hire already motivated people and inspire them. People are either motivated or they are not. Unless you give motivated people something to believe in, something bigger than their job to work toward, they will motivate themselves to find a new job and you’ll be stuck with whoever’s left.",Simon Sinek,Start with Why,"Business, Startups & Strategy"
The fear of failing inhibits and restricts performance and can throw cold water all over human passion.,Zig Ziglar,Better Than Good,"Character, Ego & Integrity"
"How could there be just one true faith?” asked Blair, a twenty-four-year-old woman living in Manhattan. “It’s arrogant to say your religion is superior and try to convert everyone else to it. Surely all the religions are equally good and valid for meeting the needs of their particular followers.",Timothy Keller,The Reason for God,Faith & the Sacred
