Quote,Author,Source,Theme
"The truth is that the study of literature requires different skills than reading for pleasure. The inability to tackle, unaided, a list of Great Books and stick to the project doesn’t demonstrate mental inadequacy—just a lack of preparation. As Richard J. Foster eloquently argues in Celebration of Discipline, we tend to think (erroneously) that anyone who can read ought to be able to study ideas. “To convince people that they must learn to study is the major obstacle,” Foster writes. “Most people assume that because they know how to read words they know how to study.” But the opposite is true:",Susan Wise Bauer,The Well-Educated Mind,"Reading, Writing & the Life of the Mind"
"The imitation of Christ that is integral to following him means that, when he calls us, he enables us to do what he calls us to do.",Os Guinness,The Call,Faith & the Sacred
"The paradox about waking up—I mean the ordinary kind of waking up that occurred to you and me this morning—is that you can’t make it happen, yet it’s inevitable. The same holds true spiritually. You can’t wish, pray, beg, force, or meditate yourself awake.",Alan Watts,The Wisdom of Insecurity,Philosophy & the Examined Life
"All roasted vegetables are most delicious when they’re completely, completely tender. Test the doneness of cauliflower and squash and root vegetables by tasting them. When you don’t wonder, but reach to eat another, they’re done.",Tamar Adler,An Everlasting Meal,"Adventure, Travel & the Good Life"
"Just. Wow. As we went over Mexico and the U.S. this morning, I caught this sprite. Sprites are TLEs or Transient Luminous Events, that happen above the clouds and are triggered by intense electrical activity in the thunderstorms below. We have a great view above the clouds, so scientists can use these types of pictures to better understand the formation, characteristics, and relationship of TLEs to thunderstorms.",@Astro_Ayers,X,Marriage & Love
"Jeremy Siegel, the famed financial author, summarized it best when he wrote: “Fear has a greater grasp on human action than does the impressive weight of historical evidence.”",Nick Maggiulli,Just Keep Buying,"Money, Wealth & Enough"
"Ironically, jobs are actually easier to enjoy than free time, because like flow activities they have built-in goals, feedback rules, and challenges, all of which encourage one to become involved in one’s work, to concentrate and lose oneself in it. Free time, on the other hand, is unstructured, and requires much greater effort to be shaped into something that can be enjoyed.",Cal Newport,Deep Work,"Discipline, Habits & Focus"
"The founding of a company, making money in the market, or the formation of an idea is messy. Reducing it to a narrative retroactively creates a clarity that never was and never will be there.",Ryan Holiday,Ego Is the Enemy,"Character, Ego & Integrity"
"Why does this belief not die? Life expectancies have dramatically improved at all ages! Early mortality does matter, but people are not living similarly long beyond childhood compared to a century ago. Rather, they are living considerably longer beyond childhood.",@cremieuxrecueil,X,"Learning, Genius & Mastery"
"There will be practical limitations on the time you can devote to work due to choices and factors outside your control. Don’t compound those with psychological limitations. What I mean by this is that you need to accept the primacy of work in the critical years (for most people, from the early twenties through your forties, but these aren’t bright lines). You are going to be spending a lot of time working—do you really want to be resentful throughout?",Scott Galloway,The Algebra of Wealth,"Money, Wealth & Enough"
"What this accounting saga constitutes is one more sad example of evil rewarded dying hard, as a great many people conclude that something can't be evil if they are profiting from it.",Charles T. Munger (edited by Peter D. Kaufman),Poor Charlie's Almanack,"Time, Mortality & Impermanence"
Learn how to be alone without being lonely. Solitude is essential for creativity.,Kevin Kelly,Excellent Advice for Living,"Learning, Genius & Mastery"
"Although Ivar dominated every conversation, he did so with a modest, almost self-deprecating air. He seemed apologetic, even embarrassed, that he knew all these things. As he moved among the passengers, he left them feeling that they, not he, had been asking all the questions. Even as Ivar held forth, they wanted him to say more, not less.",Frank Partnoy,The Match King,Investing & Markets
"Besides the Bible, I encourage people to consume one category of inspiring thoughts above all others: the biographies of great men and women.",Zig Ziglar,Better Than Good,"Character, Ego & Integrity"
"The legendary French aviation pioneer and author Antoine de Saint-Exupйry wrote: ""I have no right to say or do anything that diminishes a man in his own eyes.",Dale Carnegie,How to Win Friends and Influence People,Human Nature & Psychology
I'm desperately in the market for extremely well-written nonfiction about any subject (history preferred). Too many poor writers with great subjects I've come across lately and it's spoiling my enjoyment of the nonfiction form. Any recommendations?,@wastemailing,X,"Reading, Writing & the Life of the Mind"
"Faced with this courageous dedication, the obsessive dedication to stock options seemed immature, self-aggrandizing, and beside the point.",David Whyte,The Heart Aroused,"Work, Craft & Calling"
"Mental clarity is the child of courage, not the other way around.† Most info-Web-media-newspaper types have a hard time swallowing the idea that knowledge is reached (mostly) by removing junk from people’s heads.",Nassim Nicholas Taleb,The Bed of Procrustes,"Ambition, Risk & Courage"
"If you’re going on a date and want sex with her, having no practical plan as to where you can have sex and how you will get there will always end up with you masturbating.",Athol Kay,The Married Man Sex Life Primer 2011,Marriage & Love
"The theory of compensation asserts that calories burned through exercises are more than offset by increased caloric intake, and generally being lazier, in the hours after exercise – a way of subconsciously rewarding ourselves for the effort.",Mark Sisson,The Primal Blueprint 21-Day Total Body Transformation,"Health, Body & Longevity"
"Surprised by this violent outburst, and with the simple innocence of a child are capable of, the boy said, “I never saw anyone at Plato’s house act like that.”",Ryan Holiday,The Daily Dad,Fatherhood & Family
Your ability to consciously shape the effects you’re creating around you — we call this “Capacity.”,Sebastian Marshall and Kai Zau,Gateless,Philosophy & the Examined Life
Few want to join a community where they must adopt an overwhelming number of life-changing values before they can participate at any level.,Charles H. Vogl,The Art of Community,"Friendship, Community & Belonging"
"Shocking how well this has aged. It’s the kind of character study + sweeping view of a time/place that still wins Oscars today. It’s nearly four hours long but doesn’t feel it at all. The dialogue is top notch, with some career-best performances from some of the greats.",@DarbraDawn,X,"Learning, Genius & Mastery"
"She wanted someone to reach out daily, someone to get to know her schedule and her children’s names, someone who made her feel special, and taken care of, and cared for. And she didn’t get that.",John Berardi,Change Maker,"Business, Startups & Strategy"
There are two things you want from any chart like this - what’s your best guess on the statistical relationship and how confident are you in the validity of that relationship. The chart on the right is constructed in a way that gives you false confidence in its validity.,@EpsilonTheory,X,Marriage & Love
"Rather, excellence is one of the most authentic and human experiences there is, and it must be earned. The payoff is a deep internal satisfaction, a genuine self-respect based on effort and competence, a sense of aliveness and resonance that you won’t find anywhere else.",Brad Stulberg,The Way of Excellence,"Work, Craft & Calling"
"It can help you test your assumptions when it comes to your work (e.g., blocking two hours for reading and creative thinking on Mondays for a month), your health (e.g., going to bed at the same time every day for a week), or your relationships (e.g., date night with your spouse every other Saturday for six months).",Anne-Laure Le Cunff,Tiny Experiments,"Discipline, Habits & Focus"
More relaxed parenting styles are also on the menu—like letting your kids watch The Simpsons while you steal a daily hour of “me time.”,Bryan Caplan,Selfish Reasons to Have More Kids,Fatherhood & Family
"""All men have fears, but the brave put down their fears and go forward, sometimes to death, but always to victory"" was the motto of the King's Guard in ancient Greece.",Dale Carnegie,How to Win Friends and Influence People,"Time, Mortality & Impermanence"
"They are spending plenty of time and money on the road, but they never spent enough of themselves to begin with. Thus, their experience of travel has a diminished sense of value.",Rolf Potts,Vagabonding,"Adventure, Travel & the Good Life"
"I commend two processes to my readers. I urge skeptics to wrestle with the unexamined “blind faith” on which skepticism is based, and to see how hard it is to justify those beliefs to those who do not share them. I also urge believers to wrestle with their personal and culture’s objections to the faith. At the end of each process, even if you remain the skeptic or believer you have been, you will hold your own position with both greater clarity and greater humility.",Timothy Keller,The Reason for God,Faith & the Sacred
The solution is not to ditch social media; it is to unfollow people you don’t know and whose posts you simply look at because they have what you want.,Arthur C. Brooks and Oprah Winfrey,Build the Life You Want,"Purpose, Meaning & the Second Half of Life"
"He’d spent seven years travelling and studying – science, history and philosophy – doing well enough at everything he tried, but unable to discover anything that kindled real intellectual passion. With no struggle for financial security ahead, he’d been sinking quietly into a state of bemused complacency.",Greg Egan,Permutation City,"Adventure, Travel & the Good Life"
"Engagement: Do I know you will value me and stay close? The dictionary defines engaged as being absorbed, attracted, pulled, captivated, pledged, involved. Emotional engagement here means the very special kind of attention that we give only to a loved one. We gaze at them longer, touch them more. Partners often talk of this as being emotionally present.",Sue Johnson,Hold Me Tight,Marriage & Love
"‘Hmm. What are you up to today?’ ‘Well, I’m in the vines at the moment, getting to know the grapes. Then I’ve got some tidying up to do in the courtyard. And then I’ll probably go down to the village for lunch. Not exactly hectic.’ ‘Max?’ Charlie’s voice sounded almost serious. ‘Tell me the worst. Is it really wonderful down there?’ Max looked across the vines toward the Luberon and the great sweep of blue sky, and thought of life without suits or meetings or office politics, without traffic jams or polluted air. ‘Yes,’ he said. ‘Yes, it is.’ ‘Lucky bastard.’",Peter Mayle,A Good Year,"Adventure, Travel & the Good Life"
"The feeling of loyalty, it is clear, is the result and not the cause of comradeship. Comrades are loyal to each other spontaneously and without any need for reasons. Men may learn to be loyal out of fear or rational conviction, loyal even to those they dislike.",James B. Stockdale,Thoughts of a Philosophical Fighter Pilot,Stoicism & Self-Mastery
“We shall not cease from exploration. And the end of all our exploring will be to arrive where we started and know the place for the first time.” —T. S.,Radha Agrawal,Belong,"Friendship, Community & Belonging"
"In other words, the left hemisphere literally had no idea why its own self was acting as it was. All it could do was theorize backwards from the subject’s behavior, and it proved extremely adept at doing so. With no apparent befuddlement, no noticeable time lag, and no appearance of doubt or intent to deceive, the left side of the brain consistently generated completely plausible—although, of course, completely wrong—explanations.",Kathryn Schulz,Being Wrong,"Learning, Genius & Mastery"
Do consider the cumulative nature of risks with a low chance of happening next year but a high chance of occurring over the next decade.,Luca Dellanna (foreword by Guy Spier),Winning Long-Term Games,"Business, Startups & Strategy"
"You don’t feel surprised: this is the defining emotional absence in dreams. Surprise is a response to the violation of our expectations, an emotional indicator that our theories were in error.",Kathryn Schulz,Being Wrong,"Learning, Genius & Mastery"
"So you hereby have our permission to bury the hustle. To put in a good day’s work, day after day, but nothing more. You can play with your kids and still be a successful entrepreneur. You can have a hobby. You can take care of yourself physically. You can read a book. You can watch a silly movie with your partner. You can take the time to cook a proper meal. You can go for a long walk. You can dare to be completely ordinary every now and then.",Jason Fried and David Heinemeier Hansson,It Doesn't Have to Be Crazy at Work,"Ambition, Risk & Courage"
"Think of the fundamental questions that need asking, by teachers, students, by education innovators such as the Right Question Institute, but also by parents—because we know that parents who take the time and trouble to inquire, How can I encourage questioning in my child?, are more likely to raise inquisitive kids who grow up to be resourceful, problem-solving adults. That makes it a beautiful question worth pursuing.",Warren Berger,A More Beautiful Question,"Learning, Genius & Mastery"
"The pause hung. “What?” I asked. “Andrew, whatever story you’re telling yourself is likely wrong. Whatever it is that’s stopping you from speaking is old, tired, and worn out. Old programming designed to keep you safe. I’m not judging you. I’m just a friend, going for a walk with you.”",Jerry Colonna,Reboot,"Business, Startups & Strategy"
"In contrast, what Georg Simmel referred to as “pure sociability” is precisely the occasion in which people get together for no other purpose, higher or lower, than for the “joy, vivacity, and relief” of engaging their personalities beyond the contexts of purpose, duty, or role.",Ray Oldenburg,The Great Good Place,"Friendship, Community & Belonging"
"Simply by drawing your child’s attention to other people’s emotions during everyday encounters, you can open up whole new levels of compassion within them and exercise their upstairs brain.",Daniel J. Siegel and Tina Payne Bryson,The Whole-Brain Child,Fatherhood & Family
"The Virtus Wealth Masters Fund (VWMCX), managed by Murray Stahl and Matthew Houk, focuses on owner-operator companies. For a stock to get in the fund, management “must maintain a significant vested interest.”",Christopher W. Mayer,100 Baggers,Investing & Markets
"It's striking reading old books and many of the servants are fond of their employers in this particular way that I rarely see today. In Anna Karenina, Agafya Mikhailovna was Lenin's housekeeper, but also was his nurse as a child, and there is this particular affection.",@simonsarris,X,"Reading, Writing & the Life of the Mind"
"Thomas Aquinas, the greatest Christian theologian of the medieval era, looked at the four cardinal virtues of Plato—justice, courage, temperance, and prudence—and agreed that these were also taught in the Christian Scriptures.191 Then Aquinas added three theological virtues—faith, hope, and love—to the four cardinal virtues, because these are specifically and uniquely born out of the Christian revelation about the character of God and his grace.",Timothy Keller,Every Good Endeavor,"Ambition, Risk & Courage"
"Remember that you must behave as at a banquet. Is anything brought round to you? Put out your hand and take a moderate share. Does it pass by you? Do not stop it. Is it not yet come? Do not yearn in desire toward it, but wait till it reaches you. So with regard to children, wife, office, riches; and you will some time or other be worthy to feast with the gods.",Epictetus,The Enchiridion,Stoicism & Self-Mastery
People lose time in fragments so small their ambition never gets to file a missing persons report.,@Kpaxs,X,"Ambition, Risk & Courage"
"As Phillip Johnson so aptly put it, “One who claims to be a skeptic of one set of beliefs is actually a true believer in another set of beliefs.”",Norman L. Geisler and Frank Turek,I Don't Have Enough Faith to Be an Atheist,Faith & the Sacred
"if you have a favorite cup, that it is but a cup of which you are fond of—for thus, if it is broken, you can bear it; if you embrace your child or your wife, that you embrace a mortal—and thus, if either of them dies, you can bear",Epictetus,The Enchiridion,Stoicism & Self-Mastery
"We want to you walk away with deliberateness in thought, deliberateness in action, deliberateness in defining what matters to you and what doesn’t.",Sebastian Marshall and Kai Zau,Gateless,Philosophy & the Examined Life
"The Discipline of Perception (how we see and perceive the world around us) The Discipline of Action (the decisions and actions we take—and to what end) The Discipline of Will (how we deal with the things we cannot change, attain clear and convincing judgment, and come to a true understanding of our place in the world)",Ryan Holiday and Stephen Hanselman,The Daily Stoic,Stoicism & Self-Mastery
"Sending my two sons to all-boys school has been transformative — they are challenged constantly with energy directed towards athletics, technical disciplines, and stepping out of their comfort zone. With a motto like “The World needs good men”, there is no mistaking their mission.",@thomasehendrix,X,"Ambition, Risk & Courage"
"“The Zen mantra is ‘Sit, sit. Walk, walk. Don’t wobble.’ . . . It’s this idea that when I’m with a person, that’s total priority. Anything else is multitasking. No, no, no, no. The people-to-people, person-to-person trumps anything else. I have given my dedication to this. If I go to a play or a movie, I am at the movie. I am not anywhere else. It’s 100%—I am going to listen. If I go to a conference, I am going to go to the conference.” TF: This is very similar to Derek Sivers’s (page 184) “Don’t be a donkey” rule. In a world of distraction, single-tasking is a superpower.",Tim Ferriss,Tools of Titans,"Discipline, Habits & Focus"
"People saying, 'It'll bounce back,' or, 'Who cares, it doesn't bother anyone!' No, it isn't guaranteed to bounce back. Why is it bad that economic production continues to decline? Your quality of life, your parents', your grandparents', your children's - it's all affected.",@ChrisHatt11,X,Fatherhood & Family
"In all these cases, I found that those who maintained their love for each other scheduled time to talk to each other almost every day.",Willard F. Harley Jr.,"His Needs, Her Needs",Marriage & Love
"System noise, that is, unwanted variability in judgments that should ideally be identical, can create rampant injustice, high economic costs, and errors of many kinds.","Daniel Kahneman, Olivier Sibony, Cass R. Sunstein",Noise,Human Nature & Psychology
"The areas of great interest to the Stoics all make an appearance here: virtue, mortality, emotions, self-awareness, fortitude, right action, problem solving, acceptance, mental clarity, pragmatism, unbiased thought, and duty.",Ryan Holiday and Stephen Hanselman,The Daily Stoic,"Time, Mortality & Impermanence"
"Also extremely counterproductive is man's tendency to bet, time after time, in games of skill, like golf or poker, against people who are obviously much better players. Excessive Self-Regard Tendency diminishes the foolish bettor's accuracy in appraising his relative degree of talent.",Charles T. Munger (edited by Peter D. Kaufman),Poor Charlie's Almanack,"Learning, Genius & Mastery"
Hi Geoff. I want to bring some of my friends and colleagues together for a little cocktail party at my home. I’m looking at Wednesday the 8th at 7 p.m. Are you available then? May I send you some more info?,Nick Gray,The 2-Hour Cocktail Party,"Friendship, Community & Belonging"
"In this scenario, a rational investor, faced with a choice between two investments with the same standard deviation but different expected returns, will always pick the one with the higher expected return.",Aswath Damodaran,Investment Valuation,Investing & Markets
"Recognizing these patterns, I resolved to make closer friends, and my wife vowed to collaborate. This is not easy for anyone, and especially hard for me because we have moved a lot, so my friendships where I live don’t have roots that go back years. So we devised a plan: we started organizing our social life specifically around conversations about profound issues.",Arthur C. Brooks,From Strength to Strength,"Purpose, Meaning & the Second Half of Life"
"In Provence, she explained, as in most other wine-producing regions, there was an arrangement known as métayage. Roussel and Max’s uncle had adopted this system many years ago, whereby Roussel did the work on the vines, Uncle Henry paid for the cost of upkeep, and the two of them shared the wine. With Uncle Henry’s death, the change of proprietor had made Roussel anxious. He wanted the arrangement to continue, and was worried that Max might be thinking of ending it.",Peter Mayle,A Good Year,"Adventure, Travel & the Good Life"
Be more generous than necessary. No one on their deathbed has ever regretted giving too much away. There is no point to being the richest person in the cemetery.,Kevin Kelly,Excellent Advice for Living,"Time, Mortality & Impermanence"
"I was in my early thirties when I began, literally, to wake up to questions about my vocation. By all appearances, things were going well, but the soul does not put much stock in appearances. Seeking a path more purposeful than accumulating wealth, holding power, winning at competition, or securing a career, I had started to understand that it is indeed possible to live a life other than one’s own.",Parker J. Palmer,Let Your Life Speak,"Work, Craft & Calling"
Roger Federer won 80 percent of the matches he played during his career but only 54 percent of the points. A reminder of the fine margins where greatness can be found.,@ashleevance,X,"Ambition, Risk & Courage"
"We have to be given the chance, which we may have missed out on in childhood, to be a bit more demanding than usual in order to witness conclusively that this isn’t enough to destroy love. We can be ill and still acceptable to another person. How much more real love will feel once it has been shaken by our disease and survived.",Alain de Botton,A Therapeutic Journey,Human Nature & Psychology
Make no mistake—the parents are responsible for entitlement in their children.,Richard Watts,Entitlemania,Fatherhood & Family
"Signing up for a race also introduces another powerful motivator—accountability. It is best to sign up for these races with a friend and make an agreement to show up and finish the race, together.",Bill Burnett and Dave Evans,Designing Your New Work Life,"Work, Craft & Calling"
"The paraphilias of our time, disturbances of desire, include sexual addiction, pornography, substance disorders, and toxic consumerism, which offer to fill the empty places of the soul.",James Hollis,Finding Meaning in the Second Half of Life,"Purpose, Meaning & the Second Half of Life"
"In February 1809, at 21, he receives his share of the patrimony and is now well off and his own master. His first act is to enter himself at Göttingen University, to which he goes in October to study medicine and science.",Arthur Schopenhauer,Essays and Aphorisms,Philosophy & the Examined Life
"Even the humblest farm girl is fulfilling God’s calling. As Luther preached, “God milks the cows through the vocation of the milk maids.”",Timothy Keller,Every Good Endeavor,Faith & the Sacred
Wisdom from Seth Godin. I often go through transcripts for highlights I hope to apply to my own life. Here are a few from the sage in yellow glasses.,@tferriss,X,Faith & the Sacred
"Once you have begun to accumulate gold, finding the proper place to store it is your next layer of insurance. The best place to store gold is in an offshore private vault. The reason is simple: like anything else, the country you live in is probably not the best place to store gold.",Andrew Henderson,Nomad Capitalist,"Money, Wealth & Enough"
"“building your training into your day.” As you go about your life—work, family responsibilities, errands, chores—you can be training to be a better runner, a better athlete, or a better CrossFitter.",Kelly Starrett and T.J. Murphy,Ready to Run,"Health, Body & Longevity"
"Finding the right people, those who might offer support and encouragement along the way can have an outsized effect on your confidence and courage to keep going.",Paul Millerd,The Pathless Path,"Ambition, Risk & Courage"
